{
  "schema_version": "0.1.0",
  "evaluation_id": "example-eval-001",
  "run_id": "example-run-001",
  "record_id": "example-understanding-001",
  "status": "scored",
  "scorer": {
    "name": "exact-legality",
    "version": "0.1.0",
    "config_sha256": "0000000000000000000000000000000000000000000000000000000000000000"
  },
  "primary": {
    "name": "exact_accuracy",
    "value": 1.0,
    "minimum": 0.0,
    "maximum": 1.0,
    "higher_is_better": true
  },
  "metrics": {"exact_accuracy": 1.0, "parser_error": 0},
  "errors": [],
  "attribution": {
    "invalid_action": false,
    "parser_error": false,
    "retry_count": 0,
    "repair_count": 0,
    "fallback_used": false
  },
  "cost": {
    "latency_ms": 10.0,
    "input_tokens": 100,
    "output_tokens": 10,
    "currency": null,
    "amount": null
  },
  "artifacts": ["schemas/examples/model-output.json"]
}
